{
  "id": "price-webhook-demo",
  "name": "Price monitor with optional webhook",
  "sources": [
    {
      "id": "shop-snapshot",
      "adapter": "json-snapshot",
      "config": {
        "path": "snapshot.json"
      }
    }
  ],
  "pipeline": [
    "observation-entity"
  ],
  "evaluator": "keyword",
  "policy": {
    "includeKeywords": [
      "headphones",
      "keyboard"
    ],
    "excludeKeywords": [],
    "minimumScore": 0
  },
  "watch": {
    "rules": [
      {
        "id": "new-item",
        "path": "$",
        "operator": "created"
      },
      {
        "id": "price-drop-10",
        "path": "/attributes/price",
        "operator": "decrease-percent",
        "threshold": 10,
        "requireUnchanged": [
          "/attributes/currency"
        ]
      },
      {
        "id": "availability-change",
        "path": "/attributes/availability",
        "operator": "changed"
      }
    ]
  },
  "entitySchemas": {
    "product": {
      "fields": {
        "price": "number",
        "currency": "string",
        "availability": "string"
      }
    }
  },
  "outputs": [
    {
      "id": "price-alert-receiver",
      "adapter": "webhook",
      "config": {
        "enabled": false,
        "endpointEnv": "DISCOVERY_WEBHOOK_URL",
        "includeExisting": false,
        "maxPerExport": 20,
        "maxAttempts": 5
      }
    }
  ]
}
